Sun May 03 04:10:52 +0000 2015, @AaronDWessel, Mayweather is to fast for Paquiao! Paquiaos punches are going everywhere other than on Manny 
Sun May 03 04:10:52 +0000 2015, @Tia_Michaels, why tf was mayweather choking my baby manny... you're not suppose to do that  
Sun May 03 04:10:52 +0000 2015, @benjee_franks, Manny swinging at air  mayweather to quick  
Sun May 03 04:10:52 +0000 2015, @OMGitsYOSHI99, MANNY!MANNY!MANNY! 
Sun May 03 04:10:52 +0000 2015, @Manny24Lakers, You're a Manny! You're gonna win #Pacman 
Sun May 03 04:10:52 +0000 2015, @TheAmigo, Manny is getting ready to kick @FloydMayweather ass. He's cutting angles and starting to frustrate Floyd 
Sun May 03 04:10:52 +0000 2015, @SantoyoArturo, Hell nah nigga mayweather put my boy manny in a head lock  
Sun May 03 04:10:52 +0000 2015, @BCase43, Come on Manny 
Sun May 03 04:10:52 +0000 2015, @BigTev441, Manny don't know what to do tho. His rattled 
Sun May 03 04:10:52 +0000 2015, @imlyralagudgud, bwct si manny, taga tapos round, ngirit2 sa ya hahahaha thats the spirit hahaha you go champ 
Sun May 03 04:10:52 +0000 2015, @elovalvil, Me encanta la sonrisa de Manny cada que termina un round #PeleaDelSiglo 
Sun May 03 04:10:52 +0000 2015, @BrandonTolbert, Manny still got that smile on his face 
Sun May 03 04:10:52 +0000 2015, @XtraNicee, Manny punching at 20% 
Sun May 03 04:10:52 +0000 2015, @MikeyGilz, Mayweather holding on every time Manny gets him against the ropes. 
Sun May 03 04:10:52 +0000 2015, @hufflepxffharry, MANNY BETTER KNOCK HIS ASS OUT 
Sun May 03 04:10:52 +0000 2015, @jaxel47, 3rd to Pacq. Floyd on defensive. Manny getting good shots in. 
Sun May 03 04:10:52 +0000 2015, @ianhughes_, MANNY HAS THIS 
Sun May 03 04:10:52 +0000 2015, @GenesisDelaRoma, Buti pa si manny  https://t.co/M3SS1zdLU3 
Sun May 03 04:10:52 +0000 2015, @Jaycustomz, @MannyPacquiao c'mon manny let's gooooooooooo! 
Sun May 03 04:10:52 +0000 2015, @nic0la__, May weather wants to break manny's neck 
Sun May 03 04:10:52 +0000 2015, @derekRL24, 29-28 mayweather even though manny came close to stealing it 
Sun May 03 04:10:52 +0000 2015, @AMOakabrabbit, Manny stays with a smile on his face... Gotta love it... Dude really enjoys beating the fuck out of people and getting socked 
Sun May 03 04:10:52 +0000 2015, @willsoyum, Manny smiling after every round  
Sun May 03 04:11:09 +0000 2015, @_GIJOSE, I wanna be as happy as manny is lmao 
Sun May 03 04:11:09 +0000 2015, @Crazy_Kidf, Manny cheesing hella hard 
Sun May 03 04:11:09 +0000 2015, @SophiaGreyys, What is the reason why im watching boxing bc of niall and also manny but more for niall #BestFandomCA2015 Directioners 
Sun May 03 04:11:10 +0000 2015, @neeci_renee, Mayweather a bitch. Everytime he starts getting hit too hard he gotta hug Manny  
Sun May 03 04:11:09 +0000 2015, @MAGOO_323, La sonrisa de Pacquiao cada vez que termina un round jajaja. De a poco van entrando. Vamos Manny! 
Sun May 03 04:11:09 +0000 2015, @__Nifty, 2-1... I think Manny took this one. 
Sun May 03 04:11:09 +0000 2015, @2heRHOic, When somebody says Manny faster than Mayweather...bihh are you watching? #MayweatherVsPacquiao #FightOfTheCentury http://t.co/8A49WQfDi5 
Sun May 03 04:11:10 +0000 2015, @GermDawgg, I have Manny 3-1 
Sun May 03 04:11:09 +0000 2015, @TheRealSovo, Manny slugging recklessly smh he's gonna get laid out 
Sun May 03 04:11:10 +0000 2015, @deeeh_one, Manny keep missing! 
Sun May 03 04:11:10 +0000 2015, @Lifeof_Vonte, Manny stay with a smile on his face lol 
Sun May 03 04:11:10 +0000 2015, @ODEHsseeyy, Round 4 ! Knockout mo.na yan ! Go manny! 
Sun May 03 04:11:10 +0000 2015, @danyeluwis, nakakatuwa si manny laging nakasmileeee 
Sun May 03 04:11:10 +0000 2015, @jimmyrimski, Manny on points #MayPac 
Sun May 03 04:11:10 +0000 2015, @SaluteMing__, "@leogasga: THATS RIGHT MANNY, KEEP SMILING IN THAT BITCH FACE."  
Sun May 03 04:11:10 +0000 2015, @EJohnnyMac, Floyd keeps hugging Manny. #RelationshipProblems #MayPac #BattleForGreatness 
Sun May 03 04:11:10 +0000 2015, @bvsedxefaw, 2-1 Manny 
Sun May 03 04:11:10 +0000 2015, @KakaBabel, Manny harus TKO FM kalo mau menang krn FM unggul pukulan ke wajah Manny nih... 
Sun May 03 04:11:10 +0000 2015, @itsTaehyungEam, yeah! thats Smile of Manny!  #TeamPacquiao 
Sun May 03 04:11:10 +0000 2015, @DanDon_Gotti, MAYWEATHER is a punk!! Manny is going to knock you out ! Just wait! You scared Floyd 
Sun May 03 04:11:10 +0000 2015, @HammondGriffin, Manny all the way tho  
Sun May 03 04:11:10 +0000 2015, @Siegz_x44, Go Go Go Manny 

#Yakap 
Sun May 03 04:11:10 +0000 2015, @jdfx_, "@whatzittoooyaa: GO MANNY! teach him what humility is!" 
Sun May 03 04:11:10 +0000 2015, @eRaNomad, @JadeWasco http://t.co/Rt7xBRpvS6 
Sun May 03 04:11:10 +0000 2015, @CamiMustacciolo, Termina el round y se caga de risa manny jajajajajjajajajajajjajaja 
Sun May 03 04:11:19 +0000 2015, @ShakeyShanee, Don't be surprised if he judo flips manny  
Sun May 03 04:11:19 +0000 2015, @AndikaRifqi, Senyum senyum lucu vs mundur mundur cantik. Come on Manny @MannyPacquiao #PacquiaoMayweather 
Sun May 03 04:11:19 +0000 2015, @centenocaleb5, 4th come on manny! 
Sun May 03 04:11:19 +0000 2015, @Gemmaaa, Come on, Manny! I'm waiting for your speed attacks right now! 
Sun May 03 04:11:19 +0000 2015, @BestyMyLoves_, Surok na ang dugo ni May then si Manny shumashine yung smile  
Sun May 03 04:11:19 +0000 2015, @__tdx, manny gonna tire out before the 4th round trying to rush out all his power punches 
Sun May 03 04:11:19 +0000 2015, @MarkayLG2, Manny swinging at oxygen for 3 rounds and yall tryna get in Floyd's ass lmao 
Sun May 03 04:11:19 +0000 2015, @AConnollyTV, Manny flurries, but not really connecting 30-27 money 
Sun May 03 04:11:19 +0000 2015, @Aceyeyey, Ano kayang pabango neto ni manny nang magamit din. lahat ng kalaban neto yumayakap sakanya eh hahahahah #GoManny #PUSO 
Sun May 03 04:11:19 +0000 2015, @kanoajan, DROP HIS ASS MANNY 
Sun May 03 04:11:19 +0000 2015, @Woodylll, @TajaBlast @AphexArcade @IAmCommSheprd I tell you what I believe in my boy Manny I'll buy you one aswell if he loses 
Sun May 03 04:11:19 +0000 2015, @Maridevc, Aguante manny mierda , negro gil ojala que te noqueen .l. 
Sun May 03 04:11:19 +0000 2015, @waferthinwayne, Floyd is in total control Manny can't even hit him 
#TBE 
#TMT 
#MayPac 
Sun May 03 04:11:19 +0000 2015, @gadsacrax, wag ka. paselfie selfie lang si manny 
Sun May 03 04:11:19 +0000 2015, @sarahlindsie,  https://t.co/vQFoJ2VLOh 
Sun May 03 04:11:19 +0000 2015, @SHITember21, Team manny here  bakla ata toh nakakainis yakap yakap madaya azarr #GoManny #proudfilipino https://t.co/G7lc6TQ495 
Sun May 03 04:11:19 +0000 2015, @MaYJR21,  ya se enojo Manny!? 
Sun May 03 04:11:19 +0000 2015, @SaiyanBaker, NOT AN ENGLISH STREAMBUT HD ASF http://t.co/4sUjCBC1RU 
Sun May 03 04:11:19 +0000 2015, @theyulvincent, "I'll never let go, manny" 
Sun May 03 04:11:19 +0000 2015, @nashsakalurann, Manny, akin na lang S6 mo mananalo ka naman eh hahahahaha 
Sun May 03 04:11:19 +0000 2015, @nessagirrrrl, Like Manny, can't stand his fans. Can't stand Floyd, like his fans. *shrugs* 
Sun May 03 04:11:19 +0000 2015, @AnjntCapistrano, Napipikon na si Manny. HAHAHAHA! Dirty play si Mayweather. Dude, have some balls. You and JB belong together. #PacWins 
Sun May 03 04:11:26 +0000 2015, @scottviscomi, 2-1 Floyd manny is getting confident #MayPac 
Sun May 03 04:11:26 +0000 2015, @david_suarez87, Manny KO in the 9 or 10 round 
Sun May 03 04:11:26 +0000 2015, @cyrilylaxreyes, Yakapan?!!! Naiinggit tuloy ako. Go Manny!!! 
Sun May 03 04:11:26 +0000 2015, @alyzaxx, @NiallOfficial NIALL. YOU HAVE TO DO A FOLLOW SPREE IF MANNY WINS. 
Sun May 03 04:11:26 +0000 2015, @CBisnisOL, Demi Manny Pacquaio, Warga Filipina Bangun Sejak Pagi Hari http://t.co/6QuBtvaE7l 
Sun May 03 04:11:26 +0000 2015, @sebastianwalker, @Lam0nis Si, es rpido, pero el negro es de brazos mas largos, por eso Manny tiene q entrarle, y ese niche debe pegar duro jajaja 
Sun May 03 04:11:26 +0000 2015, @Tigrenetar, @cuervotinelli Manny me hace acordar a @ChinoMaidana , busca, tira y nada. El grone cinturea y los caga a palos!. 
Sun May 03 04:11:26 +0000 2015, @leiisummer, Wohoooo go Manny, kahit hindi ako nanunuod  
Sun May 03 04:11:26 +0000 2015, @natudeerale, Manny making me mad . He being reckless , ain't thinking smart  
Sun May 03 04:11:26 +0000 2015, @NikksRicafranca, Grabe,andaya! Pinapagod nya si manny kakahabol! Tapos saka sya susuntok pag sa gitna ng laban na! Amp! 
Sun May 03 04:11:26 +0000 2015, @AinuNisaaa, THRU  https://t.co/GnaGlknnvv 
Sun May 03 04:11:26 +0000 2015, @iamcrystaleneg, OMGGGGG GO MANNY!! 
Sun May 03 04:11:26 +0000 2015, @gl3r, Floyd loopt Manny gwn te chockeren, leek wel MMA  
Sun May 03 04:11:26 +0000 2015, @sage80_rocker, Announcers saying Floyd is toying with Manny... must be watching a different fight. 
Sun May 03 04:11:26 +0000 2015, @SnappedTwigs, @CalgaryFIames doesn't matter. Manny doesn't have a lead. All of mayweathers hands are connecting 
Sun May 03 04:11:26 +0000 2015, @_iess, oh my goshshahshhshs https://t.co/bwAAVNHJtJ 
Sun May 03 04:11:26 +0000 2015, @KkathB, BUNTIS NA NIYAN SI MANNY BUKAS 
Sun May 03 04:11:26 +0000 2015, @joyisonfire, @XnappyAgatha: @joyisonfire ehh di ba ikaw si adriana?so pambato mo si manny  oh yes  
Sun May 03 04:11:26 +0000 2015, @AsianMarc, Manny stays smilin, fuck yeah 
Sun May 03 04:11:26 +0000 2015, @lakeshow817, Manny was hitting air til the end. Hope he found a way to hit Floyd now 
Sun May 03 04:11:26 +0000 2015, @SavageNation, Photo: Manny Pacquiao and Floyd Mayweather Jr. meet in the center of the ring; fight underway - CBSSports https://t.co/5rAZmWOEd6 
Sun May 03 04:11:26 +0000 2015, @ValbuenaEllimac, Chill lang si Tito Manny Pacquiao 

Go Pacman ! 

#PacquiaoMayweather 
Sun May 03 04:11:26 +0000 2015, @narfalousnano, Basing ba si Mayweather parang gusto nalang i-hug si Manny eh 
Sun May 03 04:11:27 +0000 2015, @HauerWilliam, @FloydMayweather you have the audacity to beat the shit out of ur wife but u can't beat manny pacquial 
Sun May 03 04:11:27 +0000 2015, @MirandaSPD, Elllll guiso!!! Manny Pacquiao y Mayweather por Telearagua y Meridiano. 
Sun May 03 04:11:27 +0000 2015, @soxhawk, Win or lose, Manny's smile made this fight worth it. He understands that its for the fans! #MayPac 
Sun May 03 04:11:27 +0000 2015, @jachelleromero_, Tiwasi Manny!!! Go Pacman!! #LabanPacman 
Sun May 03 04:11:27 +0000 2015, @yesimGio, cheaters never wins lets go manny! 
Sun May 03 04:11:33 +0000 2015, @YouWantToBEEme, The fight is going so fast so people thinking manny is connecting when he's really not 
Sun May 03 04:11:33 +0000 2015, @chubbylita_, Baka madevelop ka kay Manny, Mayweather ha? Wag kang ano dyan. #MayPac #PacquiaoMayweather #GoManny 
Sun May 03 04:11:33 +0000 2015, @GreatNegrodamus, @ThatManSmitty manny missing most his punches though 
Sun May 03 04:11:33 +0000 2015, @BrixBrandonR, Go Manny! 
Sun May 03 04:11:33 +0000 2015, @PAKSHITLUKE, PLEASE MANNY 
Sun May 03 04:11:33 +0000 2015, @beyanzeldyiwel, @BoyceAvenue Great choice of bet ! Manny is the best! 
Sun May 03 04:11:33 +0000 2015, @ninetiesnialI, GO MANNY 
Sun May 03 04:11:33 +0000 2015, @OhBerns, Fight like a f*cking man Mayweather!  LOL Manny's doing it right  #PacquiaoMayweather 
Sun May 03 04:11:33 +0000 2015, @irishstfu, kung daog si manny daghan nasad kaytog bag.o nga designer bag si mommy D HAHAHAHAHAH 
Sun May 03 04:11:34 +0000 2015, @KyhrihLee, 4th Round Manny got this 
Sun May 03 04:11:33 +0000 2015, @impapinigga, MANNY THIS IS A BOXING MATCH, NOT A DIVE MEET. 
Sun May 03 04:11:34 +0000 2015, @LautiGutierrez0, Mordelo manny a lo chino maidana 
Sun May 03 04:11:34 +0000 2015, @hausofmccann, @TheMattEspinosa manny is winning tonight 
Sun May 03 04:11:33 +0000 2015, @JasperAngHotMo, Pati sabong wala haha go manny 
Sun May 03 04:11:33 +0000 2015, @EveryonesLegit, THERE WE GO MANNY 
Sun May 03 04:11:33 +0000 2015, @quickychowchow, Mag picture sad dayon sila na gigakos ni Mayweather iyang fafa Manny 
Sun May 03 04:11:34 +0000 2015, @actharrysagexxx, Focus Manny, focus. *fingers crossed*  #WeWontLetYouDown 
Sun May 03 04:11:34 +0000 2015, @taemkaipam, Round 1: Mayweather hugs Manny a lot.

That escalated quickly. 
Sun May 03 04:11:34 +0000 2015, @Stirlng, Manny's Smile is priceless 
Sun May 03 04:11:34 +0000 2015, @mikabadillo, Yun naman yon, Manny. HAHAHA 
Sun May 03 04:11:34 +0000 2015, @gildarts_bleu, They could be saying "Money". Just saying XD https://t.co/Td16fo3KaZ 
Sun May 03 04:11:34 +0000 2015, @Brian_Sixten, Let's go Manny Pacquiao!!!!! 
Sun May 03 04:11:34 +0000 2015, @MshllFlrs, Go,go,go manny!! 
Sun May 03 04:11:34 +0000 2015, @EagleCeres, @ChumelTorres en vez de Dudley que metan a Manny en SFV 
Sun May 03 04:11:34 +0000 2015, @caliiiiint, Corner target ni manny 
Sun May 03 04:11:34 +0000 2015, @therukiholic, OH GOD I CAN'T. TOO NERVOUS. MANNY WAKE THE EFF UP MAH MAN!! WE'RE ALL ROOTING FOR YOU HERE! &lt;/3 
Sun May 03 04:11:34 +0000 2015, @hugoparracycabr, @FOXSports Manny Pacquiao,muy concentrado y eso tiene nervioso a su ribal que acude a todo momento a amarrarce. 
Sun May 03 04:11:34 +0000 2015, @Sam_Crayford, COME ON MANNY 
Sun May 03 04:11:34 +0000 2015, @Envius023, Too much lunging by Manny, he's setting himself up to get caught by Floyd. 
Sun May 03 04:11:34 +0000 2015, @GI_____Raffe, Manny gotta go off legit. He can't let Floyd do this. 
Sun May 03 04:11:34 +0000 2015, @iloveizzaeseque, Round 4 na pala! Go manny!! 
Sun May 03 04:11:40 +0000 2015, @ElliotKenwyne, Manny can't get near him 
Sun May 03 04:11:40 +0000 2015, @SheriphSkills, Na Manny all man dey support for this house. 
Sun May 03 04:11:40 +0000 2015, @_920805, Manny getting more hugs than me  jkjk srs tho Mayweather plis 
Sun May 03 04:11:40 +0000 2015, @Isha_Cungkring, Dipojokin mulu nih sama Manny Pacquiao...haha 
Sun May 03 04:11:40 +0000 2015, @marluciferous, Go Manny!!!!! 
Sun May 03 04:11:40 +0000 2015, @patiencejdrew, ACABALO MANNY 
Sun May 03 04:11:40 +0000 2015, @gilbert_nghiem, For the Asians Manny 
Sun May 03 04:11:40 +0000 2015, @gadgetpilipinas, Round 4. 2 lefts on Mayweather's head plus combos! Ang lupet ni Manny! #SugodManny 
Sun May 03 04:11:40 +0000 2015, @wakum_ira, YEAH MANNY @MannyPacquiao  #PacquiaoMayweather 
Sun May 03 04:11:40 +0000 2015, @ObeyMichaael, Let's go Manny ! 
Sun May 03 04:11:40 +0000 2015, @yanimemeyanyan, Manny hinay2 lang ug sumbag sa ulo kai mabukol nya na si mayweather  
Sun May 03 04:11:40 +0000 2015, @DjallycaKate, @NiallOfficial TEAM MANNY! WOHO! 
Sun May 03 04:11:40 +0000 2015, @reneritual, Go Manny! #OneForPacman 
Sun May 03 04:11:40 +0000 2015, @jalencia15, "@Yassizzle: Yakap ka ng yakap eh. Crush mo ba si Manny?!?" HAHAHA 
Sun May 03 04:11:40 +0000 2015, @bee12nunez, Hit him manny !! 
Sun May 03 04:11:40 +0000 2015, @DaErudite, @camerondallas TEAM MANNY 
Sun May 03 04:11:40 +0000 2015, @joycetitular, Did I just see Mayweather try to grab Manny's pitotoy? 
Sun May 03 04:11:40 +0000 2015, @Theenderlp, Pica Manny, pica! 
Sun May 03 04:11:40 +0000 2015, @babytime1, Vamos Manny! !!!!!!! 
Sun May 03 04:11:40 +0000 2015, @Marekrek, @atomaraullo: Panalo ka na Manny. Pero ipanalo mo narin yung boksing para masaya, ok? Ok. 
Sun May 03 04:11:40 +0000 2015, @bernadillaangel, Mayweather! may gusto ka ba kay manny? Crush mo ata eh HAHA 
Sun May 03 04:11:40 +0000 2015, @_mvrivv, YEAH GET EM MANNY!!! 
Sun May 03 04:11:40 +0000 2015, @halmain11, Everyone voting for manny ? Well I vote MAYWEATHER . Sorry . #battle 
Sun May 03 04:11:40 +0000 2015, @yeobopls, suntukin mo na manny sa ano si gayweather 
Sun May 03 04:11:40 +0000 2015, @jeffersohn, I'd said Manny would trouble Floyd in the 1st 3 rounds, and FM would come back after that. Pac didn't land once in the first 3. #MayPac 
Sun May 03 04:11:40 +0000 2015, @romenaxchan, let's go manny let's go!! #AllForPacman 
Sun May 03 04:11:40 +0000 2015, @VellaRey, i think mayweather just bein soft now &amp; letting manny get his punches in then when it's towards the end he's gonna go all in.. 
Sun May 03 04:11:40 +0000 2015, @Iamravenutella, CORNER-IN MO LANGGGGGG MANNY! 
Sun May 03 04:11:40 +0000 2015, @BoogieBowman8, @Viittj24 Manny finna silience him tonight! 
Sun May 03 04:11:40 +0000 2015, @Blancs43, Manny gettin it in !! 
Sun May 03 04:11:40 +0000 2015, @nam_issa, Go Manny!!  #TeamPacquiao #MayPac 
Sun May 03 04:11:40 +0000 2015, @SadeColeman_, Okay Manny I see you 
Sun May 03 04:11:40 +0000 2015, @SRMoodie7, Desperate to see Manny win! But u just feel like Flloyd has it under control 
Sun May 03 04:11:40 +0000 2015, @JayDonoghueEsq, Round 2: Manny 
Sun May 03 04:11:40 +0000 2015, @rosaskimbeerly, That's it manny, corner him 
Sun May 03 04:11:40 +0000 2015, @ipathiprolo, Jimmy Kimmel Walked Manny Pacquaio to the Ring, Dressed Like a Member of Run DMC http://t.co/YiJQwb75Bb 
Sun May 03 04:11:40 +0000 2015, @imJavierIrene31, "@bernardokath: We're so excited!! Let's go manny!  #OneForPacman http://t.co/r957fV7B8g" 
Sun May 03 04:11:40 +0000 2015, @ricardollano, Por puntos creo que va ganando Manny. Pero todo el desgaste lo est haciendo l tambin. Maoso mayweather, pero inteligente. 
Sun May 03 04:11:40 +0000 2015, @Matty_T_03, If Manny don't knock him out he will lose by split decision no matter what 
Sun May 03 04:11:40 +0000 2015, @lagayakerwin, Natataranta sa footwork ng koyang manny hahaha corner ka ngay-on hahaha 
Sun May 03 04:11:40 +0000 2015, @roanncastillooo, DEFENSE MANNY 
Sun May 03 04:11:41 +0000 2015, @RokerRoar1980, Piece of piss for pink floyd ... Manny has to KO him.. Dont think he can 
Sun May 03 04:11:40 +0000 2015, @aubrchnce, @Singtel_Jerrome it doesn't allow me to watch the boxing match of manny pacqiao and may weather 
Sun May 03 04:11:41 +0000 2015, @21stJayy, Every Time Manny Bout To Catch Floyd, Floyd Wrap Em Up. Lls  
Sun May 03 04:11:40 +0000 2015, @gabbyliwanag, Manny kantahan mo na rin!!!! 
Sun May 03 04:11:41 +0000 2015, @ayppin, Manny's gotta manage his aggression. He might just walk into one of Money's straight right.#MayPac 
Sun May 03 04:11:41 +0000 2015, @MatiasFachal, Buena combinacin d #Manny! 
Sun May 03 04:11:55 +0000 2015, @rona_delara, Feeling SUPER EXCITED manny for the WIN!! 
Sun May 03 04:11:55 +0000 2015, @incrediblejad, Our guests was like! Wohoooo! Go Manny!  @ Outback Steakhouse, Libis Quezon City https://t.co/PtQOx2kMDJ 
Sun May 03 04:11:55 +0000 2015, @balotnicalum, ANG GALING YING IWAS NI MANNY 
Sun May 03 04:11:55 +0000 2015, @AfcConnor10, Mayweather just isn't allowing Manny to land a punch. Pure genius. 
Sun May 03 04:11:55 +0000 2015, @sincerelyjust, Pack in those punches, Manny!!! 
Sun May 03 04:11:55 +0000 2015, @Gloss_the_Boss, Toss up for round 3. Manny needs to stop lunging in. 
Sun May 03 04:11:55 +0000 2015, @thebeaktician, #pacman #battle lezgo Manny #PacquiaoMayweather #PacManFever http://t.co/UrTA3Adod1 
Sun May 03 04:11:55 +0000 2015, @Kaarlizzle, MANNY MANNY MANNY MANNY MANNY MANNY. MANNY MANNY 
Sun May 03 04:11:56 +0000 2015, @acculpepper, @chrislew420 http://t.co/1JpTdJTq4d 
Sun May 03 04:11:55 +0000 2015, @OhMyGaylord, Dear Manny, bantayan mo ang bayag mo. Yan ang gusto ni pretty boy. #GoManny #PacquiaoMayweather 
Sun May 03 04:11:56 +0000 2015, @wayadnanwani, Not usual for Manny for be punching air. 
Sun May 03 04:11:55 +0000 2015, @MrsTummy, Lola just asked why they're not showing the scores in between rounds. Wonders if it's because it's just Manny. 
Sun May 03 04:11:56 +0000 2015, @Ellaaaiiinnneee, Sugod na! Go manny!  
Sun May 03 04:11:55 +0000 2015, @alerocell, GO MANNY!! #TeamPacquiao #TeamPacman #PacquiaoMayweather #Philippines 
Sun May 03 04:11:56 +0000 2015, @mysticalgrey, YES MANNY PUNCH 
Sun May 03 04:11:55 +0000 2015, @ElDictamen, #Deportes #ElDictamen #LaPeleaDelSiglo

Se pone en marcha el 4R, ligero dominio de Manny sobre Mayweather. http://t.co/LZaoeuclMm 
Sun May 03 04:11:56 +0000 2015, @PSLoveNia, Then this https://t.co/ZZwzUWmG6h 
Sun May 03 04:11:56 +0000 2015, @PhilippBalbuena, Ganyan kamahal ni Mayweather si Money. Este si Manny! :)) 
Sun May 03 04:11:56 +0000 2015, @Kwamahl_2000, If Manny continues like this it's obviously going his way #MayPac 
Sun May 03 04:11:56 +0000 2015, @HeyItsYouJosh, YOU SLAY MANNY 
Sun May 03 04:11:56 +0000 2015, @LaraCaston, @BillyBills96 if manny keeps him on the ropes!!! 
Sun May 03 04:11:56 +0000 2015, @Aliatesnia, Now Watch Floyd Mayweather vs Manny Pacquiao Live Online Stream TV : http://t.co/lbd1Q0kdf9 #boxing v-144 
Sun May 03 04:11:56 +0000 2015, @SSQ1_, Manny takin a L 
Sun May 03 04:11:56 +0000 2015, @krystlemae06, KO mo na nga Manny para matapos na  
Sun May 03 04:11:56 +0000 2015, @chillybiebers, STOP HUGGING MANNY U GAY 
Sun May 03 04:11:56 +0000 2015, @camilaskush, WHEN YOU TWEET MANI INSTEAD OF MANNY BC HARMO IM SO FUCKING GROSS 
Sun May 03 04:11:56 +0000 2015, @imellasaddi, "@marsunseay: Sa kanila R1 or R3. Samen nagseselpy pa lang si Manny. " 
Sun May 03 04:12:10 +0000 2015, @thathazelkid, i want manny because underdog

floyd said he was better than Ali too 
Sun May 03 04:12:10 +0000 2015, @GopzaPeme, Team Manny 
Sun May 03 04:12:10 +0000 2015, @shangoshad, Manny's not even landing punches. But Floyd is hugging 
Sun May 03 04:12:10 +0000 2015, @BostonStrong_34, If the referee doesn't take control of the fight, Manny will do it. 
Sun May 03 04:12:10 +0000 2015, @NicxSujuELF, !! #BestFandomCA2015 ELF https://t.co/mveCAaiDEW 
Sun May 03 04:12:10 +0000 2015, @zxcpia, @KianLawley YESSSS KIAN GO FOR MANNY PACQUIAO  
Sun May 03 04:12:10 +0000 2015, @katesramos, mej bading. haha! Go Manny  #PacquaioMayweather 
Sun May 03 04:12:10 +0000 2015, @PulpMyFiction, The favorite is clear but Manny came to win! 
Sun May 03 04:12:11 +0000 2015, @VIIIXXCIX, Manny got this 
Sun May 03 04:12:10 +0000 2015, @burjafifa, im here for handy manny from disney junior 
Sun May 03 04:12:11 +0000 2015, @RonFuller7, Go Manny !  
Sun May 03 04:12:11 +0000 2015, @WeatherGuy_14, Skip is giving every round to Manny. Lol.

Typical 
Sun May 03 04:12:11 +0000 2015, @bamarkson, @jaeksoned MANNY FTW 
Sun May 03 04:12:11 +0000 2015, @AnkeWexler, Jimmy Kimmel Walked Manny Pacquaio to the Ring, Dressed Like a Member of Run DMC http://t.co/2pwlsKOdII 
Sun May 03 04:12:11 +0000 2015, @RjAzyx, Think positive talaga tayo, mananlo c Manny! #MayPac 
Sun May 03 04:12:11 +0000 2015, @JaegeeNg, Boxing bro. Boxing. BATTLE OF THE CENTURY. HINDI YAKAP FOR MANNY  
Sun May 03 04:12:11 +0000 2015, @yakseoks, Mayweather is such a flirt. He always hug manny  
Sun May 03 04:12:11 +0000 2015, @iamjaborz, Go manny! 
Sun May 03 04:12:11 +0000 2015, @mapaulaenguito, Manny vs Money 
Sun May 03 04:12:11 +0000 2015, @fivexsausages, Crush ni mayweather si manny 
Sun May 03 04:12:11 +0000 2015, @BobbySmithIII, Manny gotta eat tho 
Sun May 03 04:12:11 +0000 2015, @manu_garo, Ganando Manny. 
Sun May 03 04:12:11 +0000 2015, @D_Schap35, @2brack28 ehh. I don't think Manny is anywhere near as cocky as Floyd 
Sun May 03 04:12:11 +0000 2015, @racescobar, I'm starting to think that Mayweather is developing feelings for Manny. 
Sun May 03 04:12:11 +0000 2015, @MancincoMike, @Lastrealndn sounds like any Saturday night in the UK! Go Manny! 
Sun May 03 04:12:11 +0000 2015, @PepeRobbi, Manny!!!!!!!  
Sun May 03 04:12:11 +0000 2015, @regank, So, Mayweather has the Burger King "King" in his corner and Manny is walking out with Jimmy Kimmel. Is this an SNL skit? 
Sun May 03 04:12:11 +0000 2015, @otratlauren, HE IS SO GAY FOR MANNY FUFUFJJD 
Sun May 03 04:12:23 +0000 2015, @shnaaake, Land that fucking left Manny! 
Sun May 03 04:12:23 +0000 2015, @shailamaealonz2, @nam132527 binoxing nga din ari ni manny eh ahha 
Sun May 03 04:12:23 +0000 2015, @JessicaKastrop, Jetzt dreht Manny auf! #MayPac @DeinSkySport @WolffFuss 
Sun May 03 04:12:23 +0000 2015, @maecahramirez, Go Manny, Fvkc Mayweather!!!!  #maypac #oneformanny @ Azalea Park Condominium https://t.co/5rRsXaZGuv 
Sun May 03 04:12:23 +0000 2015, @Luke5SOS_MNL, Go Manny Pacquiao!!!!  #PacquiaoMayweather 
Sun May 03 04:12:23 +0000 2015, @Jnzbtrzmgdy, ang ganda ng ngtiti ni Manny 
Sun May 03 04:12:23 +0000 2015, @aine_vil86VK, Manny are awesome...

#TeamPacquiao 
#TeamPhilippines 
Sun May 03 04:12:23 +0000 2015, @sexysadyyy, GO MANNY!!!!! 
Sun May 03 04:12:23 +0000 2015, @DibsOnBTR, LABAN MANNY WOOOOO  
Sun May 03 04:12:23 +0000 2015, @thecaramelcream, go manny pacquiao  #pinoypride #PacquiaoMayweather 
Sun May 03 04:12:23 +0000 2015, @pauloprincesss, Sht manny!!!!! 
Sun May 03 04:12:23 +0000 2015, @_keekdasneak, @sMELyoulater it may be rigged girl but he's still proving how much of a bitch he is &amp; how scared he is of manny 
Sun May 03 04:12:23 +0000 2015, @TaigaRoler, DALE MANNY DALE ACORRALA AL NEGRO Y PEGALE DALE DALE (88)

*lase al ritmo de Dale Ingrid Dale* 
Sun May 03 04:12:23 +0000 2015, @SuperrrrAngel, @parisfranss Manny pa ba? Subok na yun tol. HAHAHA. 
Sun May 03 04:12:23 +0000 2015, @eniaruoj, OMG MANNY!!!!!!! GO!!! 
Sun May 03 04:12:23 +0000 2015, @celedonjulissa, Manny needs to catch a fade 
Sun May 03 04:12:23 +0000 2015, @latcheslwt, DONT MANNY DONT KEEP LOSING YOUR HOPES 
Sun May 03 04:12:23 +0000 2015, @Nicole_Ayn27, YAAAS MANNY 
Sun May 03 04:12:23 +0000 2015, @yamyam_ko, Heading home.. Manny go for the win..#GoMannyPacquiao 
Sun May 03 04:12:23 +0000 2015, @YiyiMenendez, Jajaja este cabron esta esperando a que   Manny se canse 
Sun May 03 04:12:23 +0000 2015, @KevinI, Big shot by Manny floyd covers up on ropes! 
Sun May 03 04:12:23 +0000 2015, @e_ecuison, Kay dayang Mayweather yan ohh! Hilig mong mgyakap noh? Tpos susuntukin sa Pacquiao. Ang daya mo! Go Manny!  #OneForPacman 
Sun May 03 04:12:23 +0000 2015, @mycobactARYAN, @gretchenho: Manny Pacquiao undoubtedly the best match for Mayweather! 
Sun May 03 04:12:23 +0000 2015, @burdi30, Lets go manny! #MannyPacquiao #MannyvsMayweather 
Sun May 03 04:12:24 +0000 2015, @__Nyquist, LETS GO MANNY 
Sun May 03 04:12:24 +0000 2015, @HannaPedraya, Patya nas mayweather Manny! Hahahaha 
Sun May 03 04:12:24 +0000 2015, @uanseas, GO MANNY 
